101,https://twitter.com/hashimoto_lo/status/1313278992619692032?s=20&t=yfXSnL_rYzbKeNs5v0ZwLg,Twitter,学者がよく口にするアメリカとイギリス。両国の学者団体には税金は投入されていないようだ。学問の自由や独立を叫ぶ前に、まずは金の面で自立しろ。年1500円ほどの会費で今の予算は確保できる。学士院の終身年金も時代にそぐわない。文科省は何をやってきた！前川喜平が次官になるようなダメダメ役所だ,2020/10/6,社会,7920,2501,2022/10/3,,https://www.buzzfeed.com/jp/yutochiba/gakujutukaigi-fact-check-2,"アメリカ、イギリスの「学者団体には税金は投入されていない」は誤り。日本学術会議をめぐり、橋下徹氏の発言が拡散

「学者がよく口にするアメリカとイギリス。両国の学者団体には税金は投入されていないようだ」とTwitterに投稿した橋下徹・元大阪府知事。しかし、この情報は誤りだ。

「日本学術会議」の新たな会員として推薦された学者6人の任命を、菅義偉首相が拒否したことをめぐる問題。

この問題について、橋下徹・元大阪府知事は「学者がよく口にするアメリカとイギリス。両国の学者団体には税金は投入されていないようだ」とTwitterに投稿した。

橋下氏が投稿した「税金は投入されていない」という情報は誤りだ。橋下氏はその後、自らのツイートが説明不足だったと引用リツイートで述べている。

しかし、最初のツイートが広く拡散し、1700回以上リツイートされている。",2020/10/12,誤り,"アメリカの「National Academy of Science（NAS）」の財務報告書（2017年）では「NASの活動の大部分は、米国政府との実費精算契約および補助金に基づいて行われています」と報告されている。

2017年度では38%にあたる6830万ドル（日本円で約72億円）、2016年度では36%にあたる6700万ドル（日本円で約70億円）が政府との契約や補助金によるものであると報告書には記されている。",https://nap.nationalacademies.org/read/25177/chapter/1#iii,,日本
102,削除済み,Twitter,"平井文夫「政治家も間違う事はあるけど選んだ国民の責任でもある。けど学者はそのプロセス経ず自分で勝手に選んでるから面倒の見ようがない。民営化すればいい。学者は６年ここで働けば学士院に行き年間250万円年金が死ぬまでもらえる。皆さんの税金から」
スタジオ驚愕ｗ
国民としてそこが一番嫌だよ",2020/10/5,政治,7877,5357,2022/10/3,日本,https://www.buzzfeed.com/jp/kotahatachi/de6kutode250onumademoraeruharihuziterebiganettode,"「学術会議で6年働けば、学士院で死ぬまで年金250万円」は誤り。フジテレビで放送、ネットで拡散

そもそも双方は独立した組織。学士院の会員にはなるためには推薦、選考が必要であり、学術会議の所属がその資格になるわけではない。フジテレビの解説委員や国会議員が拡散した情報は、ネット上で大きく広がりを見せている。",2020/10/6,誤り,"平井氏本人も10月6日放送の「とくダネ！」内で「学術会議の全員が学士院会員になれると誤解を一部に与えてしまった」と述べた。

細野豪志議員もそれを引用する形で、「日本学術会議OBの年金のことは知らなかった」などとツイートしていた。なお、長島議員はリプライで「ミスリーディングでした」と述べており、細野議員はツイートを削除のうえ、「確認せずに発信致しましたこと、お詫び致します」と訂正している。",,,日本
103,https://twitter.com/katsuyatakasu/status/1312155592237096962?s=20&t=yfXSnL_rYzbKeNs5v0ZwLg,Twitter,"現在の日本の新型コロナウイルスは
1/10000000の死亡率です。
未知のウイルスに対する過剰防衛推奨の時期は過ぎました。
恐れすぎて自粛しすぎるのは間違いだと思います。
勇気を出して日常生活を戻すべきです。
僕は経済活動自粛の後遺症で沢山の死亡者が出る次のフェーズを怖れています。",2020/10/3,医療・健康,7000,2237,2022/10/3,日本,https://www.buzzfeed.com/jp/yutochiba/covid-19-fatality-rate,"日本の新型コロナ死亡率、「1千万分の1」は誤り。致死率も低下する中、「現在の対策は過剰」は本当か？

「現在の日本の新型コロナウイルスは 1/10000000の死亡率です」という誤った情報が拡散している。10月20日時点での日本における新型コロナウイルス感染症による死亡者数は1672人。人口100万人当たりに置き換えると、死亡者は13.2人 / 100万人だ。",2020/10/20,誤り,"高須さんの示す死亡率が正確ならば、全国の死亡者はこれまでに12.6人となる。しかし、10月20日時点での日本における新型コロナウイルス感染症による死亡者数は1672人だ。

人口100万人当たりに置き換えると、死亡者は13.2人 / 100万人。高須さんのツイート内容と比較するため1000万人あたりで整理すると、新型コロナによる死亡者は132人 / 1000万人だ。

また、国立感染症研究所の感染症疫学センターが算出した調整致死率は8月30日時点では2.4%だ。

こうしたデータを踏まえると、高須さんのツイートは新型コロナのリスクを過少に評価していると言わざるを得ない。",,,日本
104,https://twitter.com/chihiro_kitei/status/1311787951227985920?s=20&t=yfXSnL_rYzbKeNs5v0ZwLg,Twitter,日本学術会議。「防衛研究は認めないが、中国の軍事研究には参加する」という結構な反日組織になっており、今回の官邸側の動きは十分理解できる。「中国との戦争はもう始まっている」と痛感させられた。「戦争の結果は戦争する前に決まっている」ので、こういう地道な改善は重要。,2020/10/2,社会,9466,5462,2022/10/3,日本,https://www.buzzfeed.com/jp/kotahatachi/thousand-talents-plan,"日本学術会議が「中国の軍事研究に参加」「千人計画に協力」は根拠不明。「反日組織」と拡散したが…

軍事転用への懸念などがアメリカで示されている中国政府による「千人計画」に対して、日本学術会議が協力しているという根拠のはっきりしない情報が広がっている。発端は自民党の甘利氏の発言にあるとみられるが、学術会議側は、これを否定している。",2020/10/9,誤り,"日本学術会議の担当者はBuzzFeed Newsの取材に対し、中国の軍事研究への協力について「そのような事業、計画などはありません」と明確に否定した。
また、「千人計画」ついても「学術会議として、計画に協力したり、交流したりするようなことはしておりません」と同様に否定した。
日本学術会議と中国の関係についていえば、中国科学技術協会との間に2015年に「協力覚書」を結んでいる。",https://www.scj.go.jp/ja/int/workshop/abstract.pdf,,日本
105,削除済み,Twitter,"イラン軍が、アメリカのドローンと交戦した様子らしいけどアメリカのドローンが異次元すぎてイラン軍は手も足も出ない…
9月9日の出来事だから先週の話です　現代の戦争って高性能なドローンを持っているか否かで勝敗が決まりそうだね",2020/9/19,社会,15000,不明,2022/10/3,日本,https://www.buzzfeed.com/jp/kotahatachi/us-iran,"「イラン軍がアメリカのドローンと交戦」動画が拡散、実際は…

「イラン軍がアメリカのドローンと交戦している」とされた動画は、ペルシャ語で9月9日、「昨晩撮影されたもの」としてYouTubeにアップされていた。その後、動画は英語圏でも拡散。日本でも同様に広がったとみられている。注意が必要だ。",2019/9/23,虚偽,"「Big Sandy Machine Gun Shoot」という、アメリカで開かれている世界最大のマシンガンの「祭典」で撮影された、ラジコン飛行機を撃ち落とす夜間射撃イベントのものとみられている。
「Big Sandy」の公式Facebookアカウントも、UFO関連のファクトチェックをしている団体の質問に対し、「確かに自分たちのイベントの動画のようにみえる」と回答。
ただし、「数百人の参加者がさまざまなカメラを使用しているため、フレームごとに比較する簡単な方法はない」としている。
",https://www.facebook.com/ufoofinterest/posts/2318981744985981,,日本
106,https://youtu.be/FgnffAcPBdc,YouTube,【鬼の一撃！台湾軍が中国戦闘機に対空ミサイル発射！】日本政府よ刮目しろ！これが国を守る覚悟だ！台湾領空侵犯した中国戦闘機に台湾軍が対空ミサイルを発射！中国戦闘機を追い返した！流石李登輝の魂宿る台湾だ！,2020/8/19,社会,,,2022/10/3,日本,https://www.buzzfeed.com/jp/kotahatachi/taiwan-missile,"「台湾軍が中国軍機にミサイル発射」YouTube動画で「マスコミが報じない」と誤情報が拡散、60万再生超える

動画では作成者とみられる男性が、イギリスのタブロイド紙「EXPRESS」による「第三次世界大戦の瀬戸際…」と題した8月12日の記事を読み上げ、ニュースを解説している。",2020/8/26,誤り,"まず、アザー長官が台湾を訪問した8月10日、中国軍が台湾海峡にある「中間線」を超え、台湾側に入ったことは、台湾国防部の公式声明でも同日中に発表されている。日本語訳は以下の通りだ。
    空軍司令部は本日（10日）、中国共産党軍の空軍に所属するJ-11、J-10型戦闘機が本日午前9時ごろ、海峡の中間線を度々超え、我が空軍が地対空ミサイルを用いてその間、常時監視したほか、直ちに警告を発し、空中哨戒兵力によって強制的に撤退させたことを明らかにした。
    空軍司令部は、中共の軍戦闘機による挑発行為により地域の安全と安定が大きく損なわれたと指摘し、我が軍は台湾領海と領空の状況を十分に把握しており、敵情の変化に応じて妥当な対処ができ、国土の安全を確保できると強調した。
ミサイルを発射したという表現は見当たらない。「地対空ミサイルによる監視」と「警告」さらに「哨戒」（パトロール）という指摘に留まっていることがわかる。
今回ファクトチェックの対象となったYouTube動画では、翻訳された「ミサイル追跡」を「発射されたミサイルによるもの」と他のソースなしに解釈したとみられる。
動画内では「EXPRESS」をGoogle翻訳したものと、まとめサイト「保守速報」の記事以外、明確なソースを示していないことからも、その可能性は極めて高い。",,,日本
107,http://web.archive.org/web/20200816083933/https://www.torontotoday.net/2020/08/15/vladimir-putins-daughter-dies-after-second-dose-of-covid-vaccine/,Website,"Vladimir Putin’s daughter DIES after second dose of COVID vaccine
Vladimir Putin’s daughter suffered unexpected side effects to the experimental Russian COVID vaccine, and has passed away in Moscow. The Kremlin has yet to make a statement on her death. A source within Russia’s inner circle stated that Putin’s daughter ? Katerina Tikhonova ? suffered a rise in temperature shortly after her second injection, and then suffered a seizure. Doctors were not able to reverse the side-effects of the vaccine, and she was pronounced dead late yesterday evening.
The Russian vaccine is named Sputnik V, after the first artificial satellite, launched into space by the Russians in 1957. It is also noteworthy that Sputnik is the name of Russia’s International News Station, which has been accused of being a propaganda wing of the Kremlin.
    Russian vaccine 'Sputnik V' may be a new Chernobyl.
    ? El Come Callao' (@panzenu) August 15, 2020
Prior to Katerina’s death, Russian Doctor Sergei Tsarenko stated that releasing the vaccine early was the better out of 2 options. In his opinion, it was better just to move ahead, as opposed to letting people die.
However, Western doctors were fearful of Russia bypassing stage 3 trials and rushing the drug to market, warning it could have devastating effects.
Abram L. Wagner, Professor of epidemiology at the University of Michigan had this to say on a rushed COVID-19 vaccine.
    Although it would be wonderful to get a vaccine into the population quickly, there could be substantial downsides if researchers and manufacturers cut corners. Imagine a vaccine that often had serious side effects that weren’t caught in small trials before it was widely administered.
    Source: https://www.pbs.org/newshour/health/russia-is-cutting-corners-on-covid-19-vaccine-clinical-trials-heres-why-they-matter
    ""The Russian vaccine’s approval comes before trials that would normally involve thousands of participants, commonly known as Phase III. Such trials are usually considered essential precursors for a vaccine to secure regulatory approval."" https://t.co/VssXTnGNSK
    ? ??? Louis (@LouieRGR) August 15, 2020
Now it appears, Katerina Tikhonova is the first official fatality of the Russian COVID-19 vaccine. Proving that Sputnik V was not safe, and skipping stage 3 trials was a misguided move on the Kremlin’s part.
The Kremlin is known to spread disinformation, so it is likely it will lie about Putin’s daughter’s death, or else blame her death on something other than the vaccine.",2020/8/15,社会,,,2022/10/3,カナダ,https://tsargrad.tv/news/toronto-today-opublikovali-sensaciju-o-docheri-putina-i-tut-zhe-udalili-lzhivyj-material_274216,"Toronto Today опубликовал ""сенсацию о дочери Путина"" и тут же удалил лживый материал
Toronto Today, по всей видимости, переплюнул всех в гонке по обесцениванию российской вакцины от коронавируса. На страницах портала опубликовали ""сенсацию о дочери Путина"", но тут же удалили лживый материал.
Масштаб вбросов о российской вакцине переходит все мыслимые пределы. Так, издание Toronto Today опубликовало так называемую сенсационную новость о дочери президента России Владимира Путина, которая испытала на себе вакцину от COVID-19.
""Vladimir Putin’s daughter suffered unexpected side effects to the experimental Russian COVID vaccine, and has passed away in Moscow..."" - говорится в оригинальной версии сообщения, которое провисело на сайте совсем недолго.
Toronto Today выпустил подробный, но совершенно фейковый материал о кончине испытавшей на себе вакцину от коронавируса российского производства. В то же время авторы ReReadQ @DigMemePray, понимая, что имеют дело с уже удалённым фейком, семь (!) раз опубликовали скриншот сообщения со своими комментариями. Например, автор блога писал, что скриншот сделал некий аноним незадолго до того, как материал был удалён. Не обошлось и без ""клюквы"":
""Сегодня этот сайт был атакован ядерным оружием, - отметил автор, хочется верить, что вполне иронично. - Вот скриншот удалённого. Насколько я знаю, нигде нет второго источника"".
Естественно, ""второго источника"" не существует. Более того, сайт Toronto Today, где всё ещё можно найти следы удалённого материала, является порталом с ограниченным доступом. То есть для прочтения конкретной аудиторией портала создали фейк, по всей видимости, под впечатлением огромной кампании по травле создателей препарата и обесцениванию достижения.
Ранее Владимир Путин сам сообщил, что его дочь опробовала на себе вакцину от коронавируса и теперь обладает иммунитетом к опасному заболеванию. Вакцину Россия создала первой в мире, вакцинация начнётся в ближайшее время. ",2020/8/17,誤り,https://www.rt.com/russia/495273-russian-military-covid-vaccine/,,,ロシア
108,https://m.weibo.cn/status/4529437779694407?,Website,"【#?京使用?真??感染人数# ?日??不超300人的原因】据??台的?道，?京都和各保健所使用FAX来收集感染者的情?。在?京都的都?新型冠状病毒?策本部只有2台FAX机器。感染者1人使用A4的??1枚?行?告。?台?真机?天只能?理上限是150人。2台FAX机?行感染者情?的?理工作，至今?天感染人数不能超?300人。
据了解，今年5月，在?京都使用?真?行?告?，漏掉111名感染者，?35人?行了重???。
根据?京都的表示，从判明??性之日起到?京都的公布?止需要??3个?段，需要3天左右。医生手写制作了??患者信息的“感染?告”，用?真?送到管?的保健所，保健所在????内容没有?常的基?上，?除个人信息后，?送到?京都，之后再???表的方式，所以需要很???。
自1月16日起日本国内出?首个感染者的半年后，仍未建立全国性的信息??系?。日本政府5月?始?用的新型冠状病毒感染症的信息??系?“HER-SYS”的普及太?，并没有好好??。HER－SYS是中央政府自治体医?机?能?共享感染者信息的系?。但到7月，在?有保健所的155个自治体中，25%的39个自治体没有利用?系?。特?是在更新?天感染人数最多??的?京都的很多保健所，?没做好使用HER－SYS的准?。一些保健所的工作人?甚至没有听??HER-SYS系?。一直手写FAX?送情?。
新?来源：東京はまだFAX 2台で感染者情報収集…「統計反映に3日かかる」
日本新??目《?道STATION》
日本情??目《Morning Show》",2020/7/22,政治,,,2022/9/30,中国,https://infact.press/category/factcheck/,この投稿の情報源としての番組には、FAXの機能により処理能力が限られることは言及していないし、東京都の感染者数が300人を超えた日もあった。,,誤り,,,,日本
